
/dev/sdb:

ATA device, with non-removable media
	Model Number:       FUJITSU MHV2080BH PL                    
	Serial Number:      NW9ZT682DCWP        
	Firmware Revision:  892C    
Standards:
	Used: ATA/ATAPI-7 T13 1532D revision 4a 
	Supported: 7 6 5 4 & some of 8
Configuration:
	Logical		max	current
	cylinders	16383	16383
	heads		16	16
	sectors/track	63	63
	--
	CHS current addressable sectors:   16514064
	LBA    user addressable sectors:  156301488
	LBA48  user addressable sectors:  156301488
	Logical  Sector size:                   512 bytes
	Physical Sector size:                   512 bytes
	device size with M = 1024*1024:       76319 MBytes
	device size with M = 1000*1000:       80026 MBytes (80 GB)
	cache/buffer size  = 8192 KBytes (type=DualPortCache)
Capabilities:
	LBA, IORDY(can be disabled)
	Standby timer values: spec'd by Standard, no device specific minimum
	R/W multiple sector transfer: Max = 16	Current = 16
	Advanced power management level: 128
	DMA: mdma0 mdma1 mdma2 udma0 udma1 udma2 udma3 udma4 *udma5 
	     Cycle time: min=120ns recommended=120ns
	PIO: pio0 pio1 pio2 pio3 pio4 
	     Cycle time: no flow control=120ns  IORDY flow control=120ns
Commands/features:
	Enabled	Supported:
	   *	SMART feature set
	    	Security Mode feature set
	   *	Power Management feature set
	   *	Write cache
	   *	Look-ahead
	   *	WRITE_BUFFER command
	   *	READ_BUFFER command
	   *	DOWNLOAD_MICROCODE
	   *	Advanced Power Management feature set
	   *	48-bit Address feature set
	   *	Device Configuration Overlay feature set
	   *	Mandatory FLUSH_CACHE
	   *	FLUSH_CACHE_EXT
	   *	SMART error logging
	   *	SMART self-test
	   *	General Purpose Logging feature set
	   *	IDLE_IMMEDIATE with UNLOAD
	   *	Gen1 signaling speed (1.5Gb/s)
	   *	Host-initiated interface power management
	   *	Phy event counters
	    	Device-initiated interface power management
	   *	Software settings preservation
	   *	SMART Command Transport (SCT) feature set
	   *	SCT Write Same (AC2)
	   *	SCT Error Recovery Control (AC3)
	   *	SCT Features Control (AC4)
	   *	SCT Data Tables (AC5)
Security: 
	Master password revision code = 65534
		supported
	not	enabled
	not	locked
	not	frozen
	not	expired: security count
		supported: enhanced erase
	62min for SECURITY ERASE UNIT. 62min for ENHANCED SECURITY ERASE UNIT. 
Checksum: correct
